{
  "schema_version": 1,
  "original_prompt": "Improve this prompt: summarize the report.",
  "target_agent": null,
  "target_host": null,
  "mode": "refine-and-run",
  "explicit_run_intent": false,
  "sufficiently_specific": true,
  "project_grounding": false,
  "preserve": {
    "must": [],
    "must_not": [],
    "scope": ["the supplied report"],
    "target_output": ["a concise summary"],
    "user_authority": [],
    "tone": [],
    "tool_provider_selection": []
  }
}
