{
  "schema_version": 1,
  "original_prompt": "Update src/config.rs. Preserve the public API. Do not add dependencies. Run cargo test. Return changed files and test evidence.",
  "target_agent": null,
  "target_host": null,
  "mode": "refine-only",
  "explicit_run_intent": false,
  "sufficiently_specific": true,
  "project_grounding": false,
  "preserve": {
    "must": ["Run cargo test."],
    "must_not": ["Do not add dependencies."],
    "scope": ["src/config.rs"],
    "target_output": ["Return changed files and test evidence."],
    "user_authority": ["Preserve the public API."],
    "tone": [],
    "tool_provider_selection": []
  }
}
