{
  "schema_version": 1,
  "original_prompt": "Make an agent prompt.",
  "target_agent": null,
  "target_host": null,
  "mode": "refine-only",
  "explicit_run_intent": false,
  "sufficiently_specific": false,
  "project_grounding": false,
  "preserve": {
    "must": [],
    "must_not": [],
    "scope": [],
    "target_output": [],
    "user_authority": [],
    "tone": [],
    "tool_provider_selection": []
  }
}
